{
  "schema_version": "v1",
  "bundle_id": "adapter-review-bundle-9ad40309881f",
  "bundleProfile": "internal_review",
  "review_status": "match",
  "model_family": "efsa_primo_adapter",
  "template_name": "efsa_primo_tabular_template",
  "walkthrough_name": "efsa_primo_tabular_alias_case",
  "check_result": {
    "status": "ok",
    "model_family": "efsa_primo_adapter",
    "input_mode": "csv_v1",
    "template_name": "efsa_primo_tabular_template",
    "walkthrough_name": "efsa_primo_tabular_alias_case",
    "template_resource_uri": "adapter-template://efsa_primo_tabular_template",
    "documentation_resource_uri": "docs://adapter-import-walkthroughs",
    "profile_selection": {
      "region_id": "eu_screening_default",
      "population_group": "child_1_6",
      "intake_window": "acute",
      "scenario_class": "bounded_acute"
    },
    "chemical_identity": {
      "preferredName": "Example"
    },
    "declared_totals": {
      "total_intake_mg_per_kg_bw_per_day": 0.00416,
      "lower_bound_mg_per_kg_bw_per_day": 0.00304,
      "upper_bound_mg_per_kg_bw_per_day": 0.00528
    },
    "input_headers": [
      "commodity",
      "iesti_mgkgbwday",
      "hr_mgkg",
      "consumption_kg_day",
      "pf",
      "lb_mgkgbwday",
      "ub_mgkgbwday"
    ],
    "header_resolution": [
      {
        "header": "commodity",
        "canonical_field": "commodity_code",
        "recognized": true
      },
      {
        "header": "iesti_mgkgbwday",
        "canonical_field": "contribution_mg_per_kg_bw_per_day",
        "recognized": true
      },
      {
        "header": "hr_mgkg",
        "canonical_field": "residue_concentration_mg_per_kg",
        "recognized": true
      },
      {
        "header": "consumption_kg_day",
        "canonical_field": "consumption_kg_per_day",
        "recognized": true
      },
      {
        "header": "pf",
        "canonical_field": "applied_processing_factor",
        "recognized": true
      },
      {
        "header": "lb_mgkgbwday",
        "canonical_field": "lower_bound_intake_mg_per_kg_bw_per_day",
        "recognized": true
      },
      {
        "header": "ub_mgkgbwday",
        "canonical_field": "upper_bound_intake_mg_per_kg_bw_per_day",
        "recognized": true
      }
    ],
    "unmapped_headers": [],
    "normalized_projection": {
      "scenario_class": "bounded_acute",
      "intake_window": "acute",
      "population_group": "child_1_6",
      "region_id": "eu_screening_default",
      "body_weight_kg": 15.0,
      "total_intake_mg_per_kg_bw_per_day": 0.00416,
      "lower_bound_mg_per_kg_bw_per_day": 0.00304,
      "upper_bound_mg_per_kg_bw_per_day": 0.00528,
      "commodity_codes": [
        "apples",
        "milk"
      ],
      "commodity_contributions": [
        {
          "commodity_code": "apples",
          "canonical_name": "Apples",
          "foodex2_code": "EXAMPLE_FDX2_APPLES_RAW",
          "rpc_code": "EXAMPLE_RPC_APPLES",
          "rpcd_code": "EXAMPLE_RPCD_APPLES_RAW",
          "processed_status": "raw_primary_commodity",
          "mapping_confidence": "provisional",
          "contribution_mg_per_kg_bw_per_day": 0.00336,
          "fraction_of_total": 0.8076923076923078,
          "residue_concentration_mg_per_kg": 0.18,
          "consumption_kg_per_day": 0.28,
          "applied_processing_factor": 1.0,
          "lower_bound_mg_per_kg_bw_per_day": 0.00224,
          "upper_bound_mg_per_kg_bw_per_day": 0.00448
        },
        {
          "commodity_code": "milk",
          "canonical_name": "Milk",
          "foodex2_code": "EXAMPLE_FDX2_MILK_RAW",
          "rpc_code": "EXAMPLE_RPC_MILK",
          "rpcd_code": "EXAMPLE_RPCD_MILK_RAW",
          "processed_status": "raw_primary_commodity",
          "mapping_confidence": "provisional",
          "contribution_mg_per_kg_bw_per_day": 0.0008,
          "fraction_of_total": 0.19230769230769235,
          "residue_concentration_mg_per_kg": 0.03,
          "consumption_kg_per_day": 0.4,
          "applied_processing_factor": 1.0,
          "lower_bound_mg_per_kg_bw_per_day": 0.0008,
          "upper_bound_mg_per_kg_bw_per_day": 0.0008
        }
      ],
      "dominant_commodity_codes": [
        "apples",
        "milk"
      ],
      "source_ids": [
        "dietary.food_vocab.crosswalk",
        "dietary.profile.eu_child_1_6",
        "dietary.taxonomy.apples",
        "dietary.taxonomy.milk",
        "efsa.default_body_weights.2012",
        "efsa.primo"
      ],
      "quality_flag_codes": [
        "external_adapter_normalized"
      ],
      "limitation_codes": [
        "default_processing_factor_applied",
        "external_adapter_normalization",
        "profile_limitations"
      ],
      "assumption_parameters": [
        "adapter_case:efsa_primo_adapter",
        "adapter_contribution_count:efsa_primo_adapter",
        "adapter_engine_version:efsa_primo_adapter"
      ]
    },
    "notes": [
      "Adapter import checks normalize supplied CSV text through the adapter harness and return a stable projection without runtime-generated IDs or timestamps.",
      "Successful results confirm CSV structure, numeric coercion, contribution-total reconciliation, commodity resolution, and profile selection for the declared scenario.",
      "This tool validates a harnessed compatibility pathway only and does not execute an official PRIMo or DEEM engine."
    ]
  },
  "comparison_result": {
    "status": "match",
    "walkthrough_name": "efsa_primo_tabular_alias_case",
    "walkthrough_resource_uri": "adapter-walkthrough://efsa_primo_tabular_alias_case",
    "template_name": "efsa_primo_tabular_template",
    "model_family": "efsa_primo_adapter",
    "compared_fields": [
      {
        "field": "template_name",
        "matches": true,
        "observed": "efsa_primo_tabular_template",
        "expected": "efsa_primo_tabular_template",
        "note": null
      },
      {
        "field": "model_family",
        "matches": true,
        "observed": "efsa_primo_adapter",
        "expected": "efsa_primo_adapter",
        "note": null
      },
      {
        "field": "unmapped_headers",
        "matches": true,
        "observed": [],
        "expected": [],
        "note": "Review is required when unrecognized CSV headers are present."
      },
      {
        "field": "total_intake_mg_per_kg_bw_per_day",
        "matches": true,
        "observed": 0.00416,
        "expected": 0.00416,
        "note": "Numeric tolerance: 1e-12."
      },
      {
        "field": "lower_bound_mg_per_kg_bw_per_day",
        "matches": true,
        "observed": 0.00304,
        "expected": 0.00304,
        "note": "Numeric tolerance: 1e-12."
      },
      {
        "field": "upper_bound_mg_per_kg_bw_per_day",
        "matches": true,
        "observed": 0.00528,
        "expected": 0.00528,
        "note": "Numeric tolerance: 1e-12."
      },
      {
        "field": "commodity_codes",
        "matches": true,
        "observed": [
          "apples",
          "milk"
        ],
        "expected": [
          "apples",
          "milk"
        ],
        "note": null
      },
      {
        "field": "commodity_contributions_mg_per_kg_bw_per_day",
        "matches": true,
        "observed": {
          "apples": 0.00336,
          "milk": 0.0008
        },
        "expected": {
          "apples": 0.00336,
          "milk": 0.0008
        },
        "note": "Contribution values are compared on canonical commodity codes."
      },
      {
        "field": "food_vocabulary_mappings",
        "matches": true,
        "observed": {
          "apples": {
            "foodex2Code": "EXAMPLE_FDX2_APPLES_RAW",
            "rpcCode": "EXAMPLE_RPC_APPLES",
            "rpcdCode": "EXAMPLE_RPCD_APPLES_RAW",
            "processedStatus": "raw_primary_commodity",
            "mappingConfidence": "provisional"
          },
          "milk": {
            "foodex2Code": "EXAMPLE_FDX2_MILK_RAW",
            "rpcCode": "EXAMPLE_RPC_MILK",
            "rpcdCode": "EXAMPLE_RPCD_MILK_RAW",
            "processedStatus": "raw_primary_commodity",
            "mappingConfidence": "provisional"
          }
        },
        "expected": {
          "apples": {
            "foodex2Code": "EXAMPLE_FDX2_APPLES_RAW",
            "rpcCode": "EXAMPLE_RPC_APPLES",
            "rpcdCode": "EXAMPLE_RPCD_APPLES_RAW",
            "processedStatus": "raw_primary_commodity",
            "mappingConfidence": "provisional"
          },
          "milk": {
            "foodex2Code": "EXAMPLE_FDX2_MILK_RAW",
            "rpcCode": "EXAMPLE_RPC_MILK",
            "rpcdCode": "EXAMPLE_RPCD_MILK_RAW",
            "processedStatus": "raw_primary_commodity",
            "mappingConfidence": "provisional"
          }
        },
        "note": "Food vocabulary fields are compared on canonical commodity codes with optional processed-commodity status retained."
      },
      {
        "field": "dominant_commodity_codes",
        "matches": true,
        "observed": [
          "apples",
          "milk"
        ],
        "expected": [
          "apples",
          "milk"
        ],
        "note": null
      },
      {
        "field": "required_source_ids_present",
        "matches": true,
        "observed": [
          "dietary.food_vocab.crosswalk",
          "dietary.profile.eu_child_1_6",
          "dietary.taxonomy.apples",
          "dietary.taxonomy.milk",
          "efsa.default_body_weights.2012",
          "efsa.primo"
        ],
        "expected": [
          "efsa.primo",
          "efsa.default_body_weights.2012"
        ],
        "note": "Extra provenance source IDs are allowed; required official source IDs must be present."
      },
      {
        "field": "required_quality_flag_codes_present",
        "matches": true,
        "observed": [
          "external_adapter_normalized"
        ],
        "expected": [
          "external_adapter_normalized"
        ],